author_display_name	author_channel_url	comment	comment_link	comment_id	comment_date	video_id
Flash Ketchum	http://www.youtube.com/channel/UCVgUggKqSMl_RmLeHh_O__Q	XCYBER  The social aspect of moving is a huge factor. Not many people can adapt to such drastic changes in a short amount of time	https://www.youtube.com/watch?v=jQCqglG5IBQ&lc=UgxbPU9Y9eRmjar0V0R4AaABAg	UgxbPU9Y9eRmjar0V0R4AaABAg	2023-07-17T18:26:15Z	jQCqglG5IBQ
LoneBurn	http://www.youtube.com/channel/UCYn08QSsoJoha3g67gaLbyQ	XCYBER   This actually might be a good approach, ive really never gone with this method of looking for jobs	https://www.youtube.com/watch?v=jQCqglG5IBQ&lc=UgwjEdynnJPFphyRUbx4AaABAg	UgwjEdynnJPFphyRUbx4AaABAg	2023-07-17T14:51:51Z	jQCqglG5IBQ
Gamer zone 2383	http://www.youtube.com/channel/UCskwkQNmsjnN5h3lz-QKtrA	XCYBER Thank you for being a guiding light on my career journey. Your videos have made a difference.	https://www.youtube.com/watch?v=jQCqglG5IBQ&lc=Ugxp-eIdrjVQqS9HfxJ4AaABAg	Ugxp-eIdrjVQqS9HfxJ4AaABAg	2023-07-18T23:14:43Z	jQCqglG5IBQ
P.L.U.S.	http://www.youtube.com/channel/UCgznqIFydemYr8q9iUYFXVg	XCYBER Thanks Mr.josh for making such great content!	https://www.youtube.com/watch?v=jQCqglG5IBQ&lc=UgyvQU-a_uZDlV8m2Hd4AaABAg	UgyvQU-a_uZDlV8m2Hd4AaABAg	2023-07-17T14:56:40Z	jQCqglG5IBQ
Mmmbeepbop	http://www.youtube.com/channel/UCT1WSjrkkejNTNmtbnVmu-w	XCYBER I agree, moving roles/locations etc. exposes you to lots of different people/ideas/skills/use-cases etc.	https://www.youtube.com/watch?v=jQCqglG5IBQ&lc=Ugx1P_x2GPRCGq_iofl4AaABAg	Ugx1P_x2GPRCGq_iofl4AaABAg	2023-07-18T08:46:14Z	jQCqglG5IBQ
Sandra	http://www.youtube.com/channel/UCjK0S5GtdIE-h8SKWLfUKMw	XCYBER Thank you, Josh, for another enlightening video. Your channel is a constant source of motivation and guidance. This video on differentiation resonates deeply.	https://www.youtube.com/watch?v=jQCqglG5IBQ&lc=UgyiBUvim7ok3svq-Pl4AaABAg	UgyiBUvim7ok3svq-Pl4AaABAg	2023-07-18T08:30:20Z	jQCqglG5IBQ
Mikey Mike	http://www.youtube.com/channel/UCKcdjpHkFfuYQJrdGVh28Zw	xcyber  I disagree, sometimes its good to hold out for the higher paying job. As long as you are steadily increasing your skills as you go. Particularly, with interview skills and technical expertise.	https://www.youtube.com/watch?v=jQCqglG5IBQ&lc=Ugw8Jwrm4iLobSDS7A94AaABAg	Ugw8Jwrm4iLobSDS7A94AaABAg	2023-07-17T20:11:22Z	jQCqglG5IBQ
Clara Grimes	http://www.youtube.com/channel/UCD9-3_TjCUFvAYR36hsr_mQ	XCYBER Thank you for being a reliable source of inspiration and knowledge. Your impact is immeasurable.	https://www.youtube.com/watch?v=jQCqglG5IBQ&lc=UgwxEuAIh8WLWitQJpl4AaABAg	UgwxEuAIh8WLWitQJpl4AaABAg	2023-07-18T23:17:17Z	jQCqglG5IBQ
Adam Lalami	http://www.youtube.com/channel/UCfxFgepsC-sVd-wPHAcyGSg	XCYBER Could you do a give away like this but for your course, I'm really interested on it, but I can't afford it. I'll appreciate your help	https://www.youtube.com/watch?v=jQCqglG5IBQ&lc=Ugy7zu2NTfIRy9OXEDB4AaABAg	Ugy7zu2NTfIRy9OXEDB4AaABAg	2023-07-17T13:54:54Z	jQCqglG5IBQ
Crazy Weired Shark	http://www.youtube.com/channel/UC4J5s3QbMbRQMhki_ABxjhQ	XCYBER Your contributions are invaluable, and I am grateful for the impact you've had on my career journey.	https://www.youtube.com/watch?v=jQCqglG5IBQ&lc=Ugy-cBG085MpL9oYTpt4AaABAg	Ugy-cBG085MpL9oYTpt4AaABAg	2023-07-19T08:31:13Z	jQCqglG5IBQ
MJ FA	http://www.youtube.com/channel/UCH4BPSmhsEfO1UFk4piCuVA	XCYBER  Is there a chance to freelance or consult as a cloud engineer Josh? Can you please do a video about this as well, thank you.	https://www.youtube.com/watch?v=jQCqglG5IBQ&lc=Ugx_i0gjNXuPnrB9Dih4AaABAg	Ugx_i0gjNXuPnrB9Dih4AaABAg	2023-07-18T22:13:25Z	jQCqglG5IBQ
Kester Edison	http://www.youtube.com/channel/UCVECqa87Qi7keKBuluE5qIg	XCYBER Your insight about the correlation between tech talent and location is thought-provoking, Josh. While major cities attract a significant number of tech professionals, there are hidden gems like Oklahoma City that offer unique advantages.	https://www.youtube.com/watch?v=jQCqglG5IBQ&lc=Ugyu4o7pfGvdIOtBFNJ4AaABAg	Ugyu4o7pfGvdIOtBFNJ4AaABAg	2023-07-18T15:41:26Z	jQCqglG5IBQ
Cinderella	http://www.youtube.com/channel/UCGNdnFmdZROvuE7eU9CJ6MQ	XCYBER Your videos have become a weekly ritual for me. Keep up the fantastic work!	https://www.youtube.com/watch?v=jQCqglG5IBQ&lc=UgxObjLlJ5CLG4D1eKx4AaABAg	UgxObjLlJ5CLG4D1eKx4AaABAg	2023-07-18T22:56:43Z	jQCqglG5IBQ
C Ena	http://www.youtube.com/channel/UCDZjcOAVZ_nKTiHp9EZDbvQ	XCYBER Thank you for being a guiding light in our professional journeys and for empowering us to achieve our career goals.	https://www.youtube.com/watch?v=jQCqglG5IBQ&lc=Ugz8uFS7vWOjz3sDVW14AaABAg	Ugz8uFS7vWOjz3sDVW14AaABAg	2023-07-18T09:06:02Z	jQCqglG5IBQ
Zion	http://www.youtube.com/channel/UCidTzlPNp6kR6IKZWLQSlcg	XCYBER Your expertise and genuine desire to help others succeed shine through in every video. Thank you for being a guiding light in our professional journeys and for empowering us to achieve greatness.	https://www.youtube.com/watch?v=jQCqglG5IBQ&lc=UgyOdJzwH196jMvHGbh4AaABAg	UgyOdJzwH196jMvHGbh4AaABAg	2023-07-18T14:41:10Z	jQCqglG5IBQ
Rhonda Mcacullay	http://www.youtube.com/channel/UCKHi8xvK4pzglLwihyIW0ng	XCYBER Thank you for being a reliable source of inspiration and guidance in the career space.	https://www.youtube.com/watch?v=jQCqglG5IBQ&lc=UgzpDgilfMzFuYa7Xux4AaABAg	UgzpDgilfMzFuYa7Xux4AaABAg	2023-07-18T23:02:20Z	jQCqglG5IBQ
Nelson Osagie	http://www.youtube.com/channel/UCF2OTuBpyDtpe32zKflcAPQ	XCYBER Security clearance another big deal, maybe you could help with alternatives to getting security clearance, are there organization that are registered to vet and grant security clearance.	https://www.youtube.com/watch?v=jQCqglG5IBQ&lc=Ugx8qHyx9Lr9EFDyRcF4AaABAg	Ugx8qHyx9Lr9EFDyRcF4AaABAg	2023-07-18T21:38:54Z	jQCqglG5IBQ
Abel Mossen	http://www.youtube.com/channel/UCVKC2439007dNRdZv7k5GPg	XCYBER Josh, your channel has been instrumental in my career development. This video on standing out in job applications is a true eye-opener.	https://www.youtube.com/watch?v=jQCqglG5IBQ&lc=UgzuoznL86qsLItFrvN4AaABAg	UgzuoznL86qsLItFrvN4AaABAg	2023-07-18T14:36:36Z	jQCqglG5IBQ
Omni	http://www.youtube.com/channel/UCyNIG6da3dBaGnYmLUEL0gQ	XCYBER Feeling inspired to learn how I can stand out from the competition and secure my first job ASAP	https://www.youtube.com/watch?v=jQCqglG5IBQ&lc=UgxWRv-37geqri3t9BJ4AaABAg	UgxWRv-37geqri3t9BJ4AaABAg	2023-07-17T18:39:03Z	jQCqglG5IBQ
Justin Al Mullings	http://www.youtube.com/channel/UCkDzZMRqOjI5gCQWzu4w3FQ	Xcyber  I loved seeing those videos of people talking about the course and how to got them their first interview, its been hard to even get a call back right now but I really think that after completing the course the flood gates will open lol.	https://www.youtube.com/watch?v=jQCqglG5IBQ&lc=Ugw4XqdbUlnhiiZbmmB4AaABAg	Ugw4XqdbUlnhiiZbmmB4AaABAg	2023-07-17T14:35:40Z	jQCqglG5IBQ
David Liam	http://www.youtube.com/channel/UCgy9LI3jFJtkuqDFOGoAnNw	XCYBER Thank you, Josh, for consistently delivering exceptional content on your channel. Your videos are a source of motivation and guidance in my career journey. This video on differentiation is another insightful piece. Your expertise and dedication to helping us succeed are truly appreciated. Keep up the fantastic work!	https://www.youtube.com/watch?v=jQCqglG5IBQ&lc=UgyKC1CdStq_3tXUoqd4AaABAg	UgyKC1CdStq_3tXUoqd4AaABAg	2023-07-18T14:44:49Z	jQCqglG5IBQ
Soumique Khan	http://www.youtube.com/channel/UCfoKwbx9f95HBUWkgVCRD1w	XCYBER It’s a very good strategy for getting the first job.	https://www.youtube.com/watch?v=jQCqglG5IBQ&lc=Ugz1_VDM5BRHa_43a5Z4AaABAg	Ugz1_VDM5BRHa_43a5Z4AaABAg	2023-07-17T14:48:27Z	jQCqglG5IBQ
Azula	http://www.youtube.com/channel/UCgfjAMe5CSI9zDFe4prwewg	XCYBER I agree with your point that it's great to get experience and build from that to find your next job!	https://www.youtube.com/watch?v=jQCqglG5IBQ&lc=Ugxxa1aaZq3oJ1YxsLJ4AaABAg	Ugxxa1aaZq3oJ1YxsLJ4AaABAg	2023-07-17T19:02:03Z	jQCqglG5IBQ
Desmond	http://www.youtube.com/channel/UCScUqq3fqjZXEdlwT4HKAzA	XCYBER Thank you, Josh, for being a constant source of career inspiration. Your channel is a go-to resource for practical advice	https://www.youtube.com/watch?v=jQCqglG5IBQ&lc=Ugwt77cgqrFQD_ZM4W14AaABAg	Ugwt77cgqrFQD_ZM4W14AaABAg	2023-07-18T14:34:07Z	jQCqglG5IBQ
Amilia Salvatore	http://www.youtube.com/channel/UCHF5O9p-LjAfr13BAzp-RSw	XCYBER Then again, I need to actively start applying and implementing these steps you're recommending and maybe just make peace with the fact that I may have to relocate temporarily if it means I can get valuable experience in this industry! :)	https://www.youtube.com/watch?v=jQCqglG5IBQ&lc=Ugxk_CAHfg7ucU0ogI14AaABAg	Ugxk_CAHfg7ucU0ogI14AaABAg	2023-07-17T15:52:09Z	jQCqglG5IBQ
Tarorot	http://www.youtube.com/channel/UCLuFTK5qqDejo7b8djO0dpw	XCYBER I agree, I need to be the best version of myself.	https://www.youtube.com/watch?v=jQCqglG5IBQ&lc=UgwVWxlG3EKGRJ3uShx4AaABAg	UgwVWxlG3EKGRJ3uShx4AaABAg	2023-07-18T00:06:10Z	jQCqglG5IBQ
Nick	http://www.youtube.com/channel/UCLCowZNS0XokVp2HMCuXbOA	XCYBER: I love the video and it’s very helpful. I know I might have to make the transition to move eventually. I’d just love it if I didn’t have to.	https://www.youtube.com/watch?v=jQCqglG5IBQ&lc=Ugw6a21eqzXDHii5SSt4AaABAg	Ugw6a21eqzXDHii5SSt4AaABAg	2023-07-17T13:51:07Z	jQCqglG5IBQ
Gerry Gonzales	http://www.youtube.com/channel/UCFsnymMSRJZgeZ9BE0Ut4Ww	xcyber Cyber Security has an entry level job position in IT even without prior experience	https://www.youtube.com/watch?v=jQCqglG5IBQ&lc=UgwqZ14meGrVy2af5QN4AaABAg	UgwqZ14meGrVy2af5QN4AaABAg	2023-07-18T03:15:22Z	jQCqglG5IBQ
Michael Igbokwe	http://www.youtube.com/channel/UCumd7lh7LEb37M6lQ9vy9AA	xcyber  I agree. It's important to do the job you really want to do as soon as possible. No matter the level of that role. These are essential skills to be learnt.	https://www.youtube.com/watch?v=jQCqglG5IBQ&lc=UgxgiVylCjZAQaSGIJh4AaABAg	UgxgiVylCjZAQaSGIJh4AaABAg	2023-07-17T20:02:36Z	jQCqglG5IBQ
BananaHead23	http://www.youtube.com/channel/UCcGY-SIiED0_j2q0qDi73Yw	XCYBER  I agree that meeting people in the new, temporary city is good for human interaction, but I would try not to form close personal relationships if I knew that I was just going to relocate in a few months or years anyways	https://www.youtube.com/watch?v=jQCqglG5IBQ&lc=UgzlrQ6vtLd-OapXZH54AaABAg	UgzlrQ6vtLd-OapXZH54AaABAg	2023-07-17T16:20:10Z	jQCqglG5IBQ
Haroon Khan	http://www.youtube.com/channel/UCMjPD0aF59Hfbjh1OT9nAhA	XCYBER - I would love to move to different place and meet new people. I think that’s a great opportunity.	https://www.youtube.com/watch?v=jQCqglG5IBQ&lc=UgwY3HElwMXLYEukiAt4AaABAg	UgwY3HElwMXLYEukiAt4AaABAg	2023-07-17T13:54:34Z	jQCqglG5IBQ
Manatsa Mazimbe	http://www.youtube.com/channel/UCRaHzsPOvRy0EuuB_SrcJuQ	XCYBER I do believe that everyone’s situation is different but it can be worth the sacrifice to maybe get your foot through the door. And you could meet a lot of people that will help you from a networking point of view. Thanks again for making these videos	https://www.youtube.com/watch?v=jQCqglG5IBQ&lc=UgyfhHHlkTbtbm05SlB4AaABAg	UgyfhHHlkTbtbm05SlB4AaABAg	2023-07-17T18:30:13Z	jQCqglG5IBQ
Jay Everything	http://www.youtube.com/channel/UCdiY606tg7qsN7KG1hUA2YA	XCYBER   Those Salaries in int the US are insane 😂, just for that reason alone I would want to go back. But I'm applying from overseas.	https://www.youtube.com/watch?v=jQCqglG5IBQ&lc=UgxvOFO2slhrGN0VWJV4AaABAg	UgxvOFO2slhrGN0VWJV4AaABAg	2023-07-17T14:44:32Z	jQCqglG5IBQ
KH	http://www.youtube.com/channel/UCCdP1JMpKlogJKySArnbDaA	XCYBER Josh, I wanted to take a moment to express my deep appreciation for the incredible value your channel brings to the table.	https://www.youtube.com/watch?v=jQCqglG5IBQ&lc=UgyycOgcfAhZxG1pYdx4AaABAg	UgyycOgcfAhZxG1pYdx4AaABAg	2023-07-19T08:28:46Z	jQCqglG5IBQ
Gold Miles	http://www.youtube.com/channel/UCsjKXly8ntlOm3HoG6zkkHQ	XCYBER Your content is not only informative but also thought-provoking and actionable.	https://www.youtube.com/watch?v=jQCqglG5IBQ&lc=Ugw_nmyZY9PjmW5Xeup4AaABAg	Ugw_nmyZY9PjmW5Xeup4AaABAg	2023-07-19T07:12:30Z	jQCqglG5IBQ
coldy	http://www.youtube.com/channel/UCjYuIJ9OtWTgEzQ5qIBzr3A	XCYBER I agree that getting a job right away is better than being picky because the opportunity cost, so I'll definitely be expanding my search when I get to that point.	https://www.youtube.com/watch?v=jQCqglG5IBQ&lc=UgyiTsWKi9BFTq-Y5ER4AaABAg	UgyiTsWKi9BFTq-Y5ER4AaABAg	2023-07-17T14:08:15Z	jQCqglG5IBQ
free guy	http://www.youtube.com/channel/UCzCJNFDC9dNUS4bIe8pS7fQ	XCYBER Josh, I want to take a moment to express my gratitude for the incredible value your channel provides.	https://www.youtube.com/watch?v=jQCqglG5IBQ&lc=Ugzko7LpDEHcDp287GJ4AaABAg	Ugzko7LpDEHcDp287GJ4AaABAg	2023-07-19T06:41:18Z	jQCqglG5IBQ
Tessy Jane	http://www.youtube.com/channel/UChkXT5zjFVG8woH5GLeQfbQ	XCYBER  I have gained invaluable knowledge, practical strategies, and a renewed sense of motivation from watching your videos	https://www.youtube.com/watch?v=jQCqglG5IBQ&lc=UgwTZjzRyIMCkUi1M3B4AaABAg	UgwTZjzRyIMCkUi1M3B4AaABAg	2023-07-19T06:18:41Z	jQCqglG5IBQ
abdulrahman sada	http://www.youtube.com/channel/UCsYv91PjOT3l2bFaABZE4ew	XCYBER Agreed.... Someone should definitely be ready to move to a different location for that first experience.	https://www.youtube.com/watch?v=jQCqglG5IBQ&lc=UgxB5t6mlbQ4FaYv6uF4AaABAg	UgxB5t6mlbQ4FaYv6uF4AaABAg	2023-07-18T03:15:28Z	jQCqglG5IBQ
goethe23	http://www.youtube.com/channel/UChDpr_DIpw4dv611hPyUR3Q	XCYBER   I will be checking out the rest of your videos for the tips mentioned in raising the stats for the job search.	https://www.youtube.com/watch?v=jQCqglG5IBQ&lc=UgwXPbtvn7bRlyVss0F4AaABAg	UgwXPbtvn7bRlyVss0F4AaABAg	2023-07-18T16:34:08Z	jQCqglG5IBQ
0xRAND0M	http://www.youtube.com/channel/UCuGxTXCkjWbH-9rEjwqAwRg	XCYBER  A very informative video especially for people like me who haven't broken into the industry yet.	https://www.youtube.com/watch?v=jQCqglG5IBQ&lc=UgwYimUM_w9BBEIaGDB4AaABAg	UgwYimUM_w9BBEIaGDB4AaABAg	2023-07-17T15:53:12Z	jQCqglG5IBQ
Piper Peter	http://www.youtube.com/channel/UChf5snB5PzWWv1XvOap648Q	XCYBER Your authentic passion for empowering others is evident in every word you speak. Thank you for sharing your knowledge and making a lasting difference in my career journey.	https://www.youtube.com/watch?v=jQCqglG5IBQ&lc=Ugz6yoEe9c4ej9RAnYF4AaABAg	Ugz6yoEe9c4ej9RAnYF4AaABAg	2023-07-19T07:44:42Z	jQCqglG5IBQ
Jason	http://www.youtube.com/channel/UC02LyWf1pyjnEgTAlFBeAxQ	XCYBER  hello from the IT course!	https://www.youtube.com/watch?v=jQCqglG5IBQ&lc=UgwhRTuCb4-QKY6_xht4AaABAg	UgwhRTuCb4-QKY6_xht4AaABAg	2023-07-18T19:11:51Z	jQCqglG5IBQ
Øx Fynnesse	http://www.youtube.com/channel/UCJQS4cwipdb1fG68ReNBhtg	XCYBER Cybersecurity is like one of the hardest industries to break into. Thanks for the tip	https://www.youtube.com/watch?v=jQCqglG5IBQ&lc=UgwyMVhFj4Vj31PfsjR4AaABAg	UgwyMVhFj4Vj31PfsjR4AaABAg	2023-07-17T14:17:24Z	jQCqglG5IBQ
Ahmad Umar	http://www.youtube.com/channel/UCUZZ-NDPLHk9QQ6O_C122mw	XCYBER I think this are good steps to take.	https://www.youtube.com/watch?v=jQCqglG5IBQ&lc=UgwSGvXnO_KrFPl7Sop4AaABAg	UgwSGvXnO_KrFPl7Sop4AaABAg	2023-07-18T02:59:22Z	jQCqglG5IBQ
Happy Girl	http://www.youtube.com/channel/UCcbgI65QaMajdhEsmnGIQOA	XCYBER , your channel is my go-to destination for career advice. This video on standing out in job applications is a game-changer. Your expertise and genuine desire to help others are evident.	https://www.youtube.com/watch?v=jQCqglG5IBQ&lc=Ugyq5rKjHmBR-dUS8HV4AaABAg	Ugyq5rKjHmBR-dUS8HV4AaABAg	2023-07-18T08:59:18Z	jQCqglG5IBQ
karltek	http://www.youtube.com/channel/UC9lv-VHhGSLig_5vzui9Zmw	XCYBER  True, GIT GUD, getting good at what you do can bring you to places or get you better opportunities	https://www.youtube.com/watch?v=jQCqglG5IBQ&lc=UgyvPFgvXVzFDIk1o8d4AaABAg	UgyvPFgvXVzFDIk1o8d4AaABAg	2023-07-17T19:17:18Z	jQCqglG5IBQ
Nelly nosa violet	http://www.youtube.com/channel/UCKrrLL9aMvbHi9Z76BoXC4g	XCYBER Thank you, Josh, for consistently delivering exceptional content on your channel. This video on differentiation is yet another masterpiece.	https://www.youtube.com/watch?v=jQCqglG5IBQ&lc=UgwC7HkMRjeGN3_oLCF4AaABAg	UgwC7HkMRjeGN3_oLCF4AaABAg	2023-07-18T14:31:55Z	jQCqglG5IBQ
0xrohit	http://www.youtube.com/channel/UCOSKsJ8oVy1FrLJR4Gb7vGw	XCYBER I Strongly agreed about the way of choosing the city sir	https://www.youtube.com/watch?v=jQCqglG5IBQ&lc=UgwYcYORAc0iP4CMr4l4AaABAg	UgwYcYORAc0iP4CMr4l4AaABAg	2023-07-18T03:28:20Z	jQCqglG5IBQ
Ben	http://www.youtube.com/channel/UCP1epMSsKeaKZBlDMpZdBmg	XCYBER Thanks for the vids and contest opportunity. One other thing you could've mentioned is Summer internships! Most all of them take applications and interview in September-December for Summer programs of the next year	https://www.youtube.com/watch?v=jQCqglG5IBQ&lc=UgzbEzWgHYK0pmRFdMF4AaABAg	UgzbEzWgHYK0pmRFdMF4AaABAg	2023-07-17T14:59:46Z	jQCqglG5IBQ
StopTheCap	http://www.youtube.com/channel/UCT2OQmLwOJ1mnu8eTQQTVsw	XCYBER I agree that you should do a course giveaway. I would much rather have the course than money.	https://www.youtube.com/watch?v=jQCqglG5IBQ&lc=UgyVtd8wvH1gXn0_iv94AaABAg	UgyVtd8wvH1gXn0_iv94AaABAg	2023-07-17T14:38:15Z	jQCqglG5IBQ
Mark Sterling	http://www.youtube.com/channel/UC65PR7zyfs3p0vVzE1Ez6iw	XCYBER I can't express enough appreciation for the outstanding cyber security courses you provide, Josh. Your videos are a testament to your profound knowledge and passion for this field. The knowledge and insights I have acquired from your courses have significantly enriched my understanding of cyber security. Your videos are not only enlightening but also visually captivating and skillfully produced. Thank you for creating such remarkable resources that contribute to the growth and development of individuals in the cyber security domain.	https://www.youtube.com/watch?v=jQCqglG5IBQ&lc=Ugw1dxThLAh23KPuTV94AaABAg	Ugw1dxThLAh23KPuTV94AaABAg	2023-07-17T22:57:33Z	jQCqglG5IBQ
Mike Dredge	http://www.youtube.com/channel/UCzhSr4BSjplY2fe-Ucs5q0Q	XCYBER The knowledge and insights you provide have been instrumental in my professional growth.	https://www.youtube.com/watch?v=jQCqglG5IBQ&lc=Ugy6CKNnuTA2rniW8GZ4AaABAg	Ugy6CKNnuTA2rniW8GZ4AaABAg	2023-07-19T08:03:33Z	jQCqglG5IBQ
Testimony	http://www.youtube.com/channel/UCsqNGgzywfF7x0haZHTP5Jw	XCYBER This video on standing out in job applications is truly eye-opening. Your expertise shines through, and your guidance is invaluable. Thank you for sharing your knowledge and for inspiring us to reach our full potential.	https://www.youtube.com/watch?v=jQCqglG5IBQ&lc=UgxLe3L30Vjmdco_i554AaABAg	UgxLe3L30Vjmdco_i554AaABAg	2023-07-18T11:10:09Z	jQCqglG5IBQ
fernando romero	http://www.youtube.com/channel/UCDYrO_piL7_uJECq_tnjj4w	XCYBER  I appreciate the practical advice you shared in this video. Breaking into the cyber security field can be challenging, and your suggestion of expanding the job search region makes a lot of sense. It's a great way to increase opportunities and get started in the industry. Thank you for sharing this helpful strategy!	https://www.youtube.com/watch?v=jQCqglG5IBQ&lc=UgzyKYjxu78T4cUePml4AaABAg	UgzyKYjxu78T4cUePml4AaABAg	2023-07-17T14:19:34Z	jQCqglG5IBQ
Graves Jordan	http://www.youtube.com/channel/UCNSDNHP7vuPC88ELHUHivGg	XCYBER Thank you for being a trusted mentor through your videos.	https://www.youtube.com/watch?v=jQCqglG5IBQ&lc=UgzVMkX1m-oaadwBS994AaABAg	UgzVMkX1m-oaadwBS994AaABAg	2023-07-18T22:21:41Z	jQCqglG5IBQ
Troy Smith	http://www.youtube.com/channel/UCRwaxneQJWrQs7MrMK-epPg	XCYBER Networking seems to be the biggest factor in getting hired in CS/IT.	https://www.youtube.com/watch?v=jQCqglG5IBQ&lc=UgwewzeNV_xtF_8ZQXF4AaABAg	UgwewzeNV_xtF_8ZQXF4AaABAg	2023-07-17T14:53:32Z	jQCqglG5IBQ
Ephraxxxxx	http://www.youtube.com/channel/UCWmsoSox58_fE4BzIfu97Vw	XCYBER The knowledge and insights you provide have been invaluable in my professional growth.	https://www.youtube.com/watch?v=jQCqglG5IBQ&lc=UgwhqYBcC4WCDyT2mqZ4AaABAg	UgwhqYBcC4WCDyT2mqZ4AaABAg	2023-07-19T07:47:48Z	jQCqglG5IBQ
TheProgrammingMogul	http://www.youtube.com/channel/UCYErcfC-mCsTHwNAsN-m7ZA	XCYBER I have really enjoyed all the last videos especially the interviews which to my knowledge is not something a lot of youtubers have done to showcase the application process.	https://www.youtube.com/watch?v=jQCqglG5IBQ&lc=UgzxsqHkITH4rwgiLFR4AaABAg	UgzxsqHkITH4rwgiLFR4AaABAg	2023-07-17T20:52:22Z	jQCqglG5IBQ
0xkakachi	http://www.youtube.com/channel/UCKpB_UPsYQ3Bty1liU4VtCA	XCYBER Thank you for your video....soon i am going to get a job sir	https://www.youtube.com/watch?v=jQCqglG5IBQ&lc=UgyU5-FnMCj9q50SAi14AaABAg	UgyU5-FnMCj9q50SAi14AaABAg	2023-07-18T03:33:35Z	jQCqglG5IBQ
Alexander Goldfarb	http://www.youtube.com/channel/UC6K1plp65Q7WIMuv91P6xfw	XCYBER How do you recommend expanding your the geographic area when creating applications? Just manually setting it to the closest states (or flyover states, etc) and do it like that?	https://www.youtube.com/watch?v=jQCqglG5IBQ&lc=Ugy6uQQyI9UaCm-TeAh4AaABAg	Ugy6uQQyI9UaCm-TeAh4AaABAg	2023-07-17T23:35:24Z	jQCqglG5IBQ
Alexander Hamilton	http://www.youtube.com/channel/UCld7H22b4-8rETVvsF3PPSw	XCYBER thank you for the chance to win $50	https://www.youtube.com/watch?v=jQCqglG5IBQ&lc=UgwKQW5eD984e0i_mp54AaABAg	UgwKQW5eD984e0i_mp54AaABAg	2023-07-18T16:59:23Z	jQCqglG5IBQ
Prosper Wisdom	http://www.youtube.com/channel/UCRORDpepo3qMkaGz29ZaZpg	XCYBER Your expertise and genuine desire to help others are evident. Thank you for being a constant source of inspiration and for empowering us to achieve greatness.	https://www.youtube.com/watch?v=jQCqglG5IBQ&lc=UgzRJJp6Xak4ynbhowR4AaABAg	UgzRJJp6Xak4ynbhowR4AaABAg	2023-07-18T14:19:40Z	jQCqglG5IBQ
Danny estudillo	http://www.youtube.com/channel/UC0KkK9fhEmw0XjjhX5toEhA	XCYBER thank you for the chance to win $50	https://www.youtube.com/watch?v=jQCqglG5IBQ&lc=UgzlOJWpnKdDwcwtecN4AaABAg	UgzlOJWpnKdDwcwtecN4AaABAg	2023-07-18T16:24:40Z	jQCqglG5IBQ
Jerry Asagba	http://www.youtube.com/channel/UCh2P_cGM9m_j6wXEg1VAalg	XCYBER although it’s a solid idea it also takes into account that you have money saved like you said If I’m in USA looking for a job, how would I have enough money to travel and settle in Japan, not sure the employer would do that.	https://www.youtube.com/watch?v=jQCqglG5IBQ&lc=UgwPIXB32c8MPargNdp4AaABAg	UgwPIXB32c8MPargNdp4AaABAg	2023-07-17T14:08:43Z	jQCqglG5IBQ
Health Hero	http://www.youtube.com/channel/UCvQJXAqJcqbdQfuITiGAl5A	XCYBER I'm very motivated and curious	https://www.youtube.com/watch?v=jQCqglG5IBQ&lc=UgyBhqYEENGVQsM8xpp4AaABAg	UgyBhqYEENGVQsM8xpp4AaABAg	2023-07-17T18:33:53Z	jQCqglG5IBQ
Emberlie Belizaire	http://www.youtube.com/channel/UCVYIivin7cqLbcwwWqwh0lQ	"XCYBER I agree with getting ""out there"" in terms of where you're applying but I've been applying for onsite help desk jobs after completing your IT course and don't see myself moving states for that job title lol. The job title just has to be worth the move."	https://www.youtube.com/watch?v=jQCqglG5IBQ&lc=UgzFXcgb4k3-Q5gooIN4AaABAg	UgzFXcgb4k3-Q5gooIN4AaABAg	2023-07-17T15:52:31Z	jQCqglG5IBQ
L FAN	http://www.youtube.com/channel/UCr2CwK0iERrcAA0A1h3jC1Q	XCYBER Thank you, Josh, for consistently delivering exceptional content. This video on differentiation hits the mark. Your channel is a wellspring of career knowledge.	https://www.youtube.com/watch?v=jQCqglG5IBQ&lc=UgxuUesw7r6iAMv7s6p4AaABAg	UgxuUesw7r6iAMv7s6p4AaABAg	2023-07-18T08:40:17Z	jQCqglG5IBQ
bagery	http://www.youtube.com/channel/UCoS6i0_VrVDHnJsHp6cctlQ	XCYBER Yes, definitely not for everyone. However, I do envy those for whom it is. Life is simply too short to endure another racist, homophobic podunk.	https://www.youtube.com/watch?v=jQCqglG5IBQ&lc=UgzmtB8_pOT2JWi5xCF4AaABAg	UgzmtB8_pOT2JWi5xCF4AaABAg	2023-07-18T21:45:37Z	jQCqglG5IBQ
Nashim Campa	http://www.youtube.com/channel/UCFETKg4HZ63LLxhZl4D9jZg	XCYBER I agree with most of the video, but I’d also add that right now since it’s the middle of the summer, many hiring managers are out on vacation with their kids, so hiring may be a little slow, regardless of the location. I’ve been hearing it may pick back up in September.	https://www.youtube.com/watch?v=jQCqglG5IBQ&lc=Ugwl3KBPFteD-dxc9N94AaABAg	Ugwl3KBPFteD-dxc9N94AaABAg	2023-07-17T16:41:21Z	jQCqglG5IBQ
Olivia Iris	http://www.youtube.com/channel/UCyHcVh8i-EDlvbr1QUdkS9A	XCYBER Thank you for being a guiding light and empowering us to reach our fullest potential.	https://www.youtube.com/watch?v=jQCqglG5IBQ&lc=UgzFxQTT_A4nSjgGCMV4AaABAg	UgzFxQTT_A4nSjgGCMV4AaABAg	2023-07-19T06:05:16Z	jQCqglG5IBQ
Maxwell Endurance	http://www.youtube.com/channel/UCfVQHYgT9vH2OMDo7nrLuMQ	XCYBER Words cannot express how grateful I am for stumbling upon your channel, Josh.	https://www.youtube.com/watch?v=jQCqglG5IBQ&lc=UgyUBtis5gJGAFu-poh4AaABAg	UgyUBtis5gJGAFu-poh4AaABAg	2023-07-19T06:07:53Z	jQCqglG5IBQ
light💡shine🔆	http://www.youtube.com/channel/UCh7I0d7iMYeiLnwaM7pbuvg	XCYBER Thank you for shedding light on various career-related topics that often go unnoticed.	https://www.youtube.com/watch?v=jQCqglG5IBQ&lc=Ugyyd5P0KOsd6WrHgB54AaABAg	Ugyyd5P0KOsd6WrHgB54AaABAg	2023-07-18T22:40:34Z	jQCqglG5IBQ
Paul Jr 	http://www.youtube.com/channel/UCQy1bOC-n0f18eKEw3om3Qg	XCYBER Excited to see more of your content	https://www.youtube.com/watch?v=jQCqglG5IBQ&lc=UgzW_iJDvUlWMOvkWAt4AaABAg	UgzW_iJDvUlWMOvkWAt4AaABAg	2023-07-17T17:18:01Z	jQCqglG5IBQ
Thesilvereyedude	http://www.youtube.com/channel/UCusaMinZ2co7MJxbENHTGgg	XCYBER thank you for the opportunity to win $50	https://www.youtube.com/watch?v=jQCqglG5IBQ&lc=Ugx4gyOy9crGCMw7GB54AaABAg	Ugx4gyOy9crGCMw7GB54AaABAg	2023-07-18T17:08:29Z	jQCqglG5IBQ
